{
  "formatVersion": "0.1",
  "engineVersion": "0.1.0-dev",
  "projection": "paired-balance-preview-v0",
  "homeId": "hexrelatum",
  "provenance": {
    "repository": "https://github.com/wratixor/hexrelatum",
    "parentRepository": null,
    "upstreamRepository": "https://github.com/wratixor/hexrelatum",
    "defaultBranch": "main",
    "codeLicense": "AGPL-3.0-or-later",
    "contentLicense": "CC-BY-SA-4.0",
    "schemaLicense": "CC0-1.0"
  },
  "concepts": [
    {
      "id": "article-format",
      "title": "Формат статьи",
      "path": "wiki/engine/article-format.md",
      "coordinates": [
        3.0,
        4.0,
        2.0,
        5.0,
        4.0,
        3.0
      ],
      "body": "# Формат статьи\n\nКаждая статья является обычным Markdown-файлом с небольшим заголовком\nметаданных. Обязательны стабильный идентификатор, название и шесть положительных\nкоординат.\n\n```markdown\n---\nid: example\ntitle: Пример\ncoordinates: [2, 5, 1, 4, 3, 3]\nhome: false\nmap: false\n---\n```\n\nВ тексте поддерживаются ссылки, **жирное**, *курсивное*, ~~зачёркнутое~~ и\n++подчёркнутое++ оформление. Относительная ссылка на другую статью создаёт\nнаправленное упоминание и двусторонний навигационный переход.\n\nГлавная страница — такая же статья. Она может иметь любые координаты, но должна\nссылаться на важные точки входа, как это делает [Hexrelatum](../index.md).\n",
      "home": false,
      "map": false,
      "incomingCount": 2,
      "outgoingIds": [
        "hexrelatum"
      ],
      "linkedIds": [
        "engine-about",
        "hexrelatum"
      ],
      "externalLinks": []
    },
    {
      "id": "cat",
      "title": "Кошка",
      "path": "wiki/cats/cat.md",
      "coordinates": [
        4.0,
        5.0,
        7.0,
        2.0,
        3.0,
        4.0
      ],
      "body": "# Кошка\n\nКошка — домашнее животное и удобный нелорный пример статьи, не являющейся\nдокументацией самого движка.\n\nКошка связана с [графом](../mathematics/graph.md), потому что демонстрирует, что\nодин движок может соединять технические и обыденные знания. Внешнее чтение:\n[статья о домашней кошке в Википедии](https://ru.wikipedia.org/wiki/Кошка).\n",
      "home": false,
      "map": false,
      "incomingCount": 2,
      "outgoingIds": [
        "graph"
      ],
      "linkedIds": [
        "graph",
        "hexrelatum"
      ],
      "externalLinks": [
        {
          "label": "статья о домашней кошке в Википедии",
          "href": "https://ru.wikipedia.org/wiki/Кошка"
        }
      ]
    },
    {
      "id": "engine-about",
      "title": "Как устроен Hexrelatum",
      "path": "wiki/engine/about.md",
      "coordinates": [
        4.0,
        2.0,
        3.0,
        5.0,
        6.0,
        2.0
      ],
      "body": "# Как устроен Hexrelatum\n\nHexrelatum разделяет источник знаний и их отображение.\n\n- Статьи лежат в каталоге [wiki](article-format.md).\n- Открытый индексатор строит проверяемый SQLite-индекс и статическое\n  представление графа.\n- Браузерный движок показывает выбранную статью и только непосредственно\n  связанные с ней точки.\n- При переходе выбранная статья становится локальным `0 · 0 · 0`, но её\n  исходные шесть координат не изменяются.\n\nПроект распространяется вместе с [инструкциями и лицензиями](licensing.md).\nИстория идеи использует образ [бейгла знаний](everything-bagel.md), однако\nвизуальный язык проекта остаётся самостоятельным.\n",
      "home": false,
      "map": true,
      "incomingCount": 2,
      "outgoingIds": [
        "article-format",
        "everything-bagel",
        "licensing"
      ],
      "linkedIds": [
        "article-format",
        "everything-bagel",
        "hexrelatum",
        "licensing"
      ],
      "externalLinks": []
    },
    {
      "id": "everything-bagel",
      "title": "Бейгл знаний",
      "path": "wiki/engine/everything-bagel.md",
      "coordinates": [
        5.0,
        3.0,
        5.0,
        3.0,
        5.0,
        3.0
      ],
      "body": "# Бейгл знаний\n\nВнутренняя метафора Hexrelatum отсылает к бейглу всего из фильма\n«Всё везде и сразу»: множество знаний можно свернуть в одну обозримую форму, а\nлюбая статья способна стать центром локальной версии «всего».\n\nЭто смысловая отсылка, а не копирование оформления фильма. В центре карты\nнаходится выбранный [концепт](about.md), а не чёрная дыра или отдельная\nпривилегированная сущность.\n",
      "home": false,
      "map": false,
      "incomingCount": 1,
      "outgoingIds": [
        "engine-about"
      ],
      "linkedIds": [
        "engine-about"
      ],
      "externalLinks": []
    },
    {
      "id": "graph",
      "title": "Граф",
      "path": "wiki/mathematics/graph.md",
      "coordinates": [
        2.0,
        5.0,
        4.0,
        3.0,
        6.0,
        2.0
      ],
      "body": "# Граф\n\nГраф состоит из точек и связей между ними. В Hexrelatum точкой является\nстатья, а относительная Markdown-ссылка создаёт связь.\n\nНаправление ссылки сохраняется для подсчёта входящих упоминаний. Для навигации\nсвязь читается в обе стороны: можно перейти как к упомянутой статье, так и\nобратно к статье, которая её упомянула.\n\nРабочая важность точки равна количеству различных статей, которые на неё\nссылаются. Повторные ссылки из одной статьи учитываются один раз, а самоссылки\nне увеличивают важность.\n\nСвязанный пример: [кошка](../cats/cat.md).\n",
      "home": false,
      "map": true,
      "incomingCount": 3,
      "outgoingIds": [
        "cat"
      ],
      "linkedIds": [
        "cat",
        "hexrelatum",
        "six-coordinates"
      ],
      "externalLinks": []
    },
    {
      "id": "hexrelatum",
      "title": "Hexrelatum",
      "path": "wiki/index.md",
      "coordinates": [
        3.0,
        2.0,
        5.0,
        4.0,
        2.0,
        6.0
      ],
      "body": "# Hexrelatum\n\nHexrelatum — открытая Git-вики, в которой любая статья становится временным\nцентром карты непосредственно связанных знаний.\n\nНачать знакомство можно с [устройства движка](engine/about.md),\n[формата статьи](engine/article-format.md), [графа](mathematics/graph.md) или\n[кошки](cats/cat.md).\n\nИсходные знания хранятся в Markdown, а карта воспроизводимо собирается открытым\nлокальным индексатором. Вики можно читать, клонировать и изменять вместе с её\nдвижком.\n",
      "home": true,
      "map": true,
      "incomingCount": 1,
      "outgoingIds": [
        "article-format",
        "cat",
        "engine-about",
        "graph"
      ],
      "linkedIds": [
        "article-format",
        "cat",
        "engine-about",
        "graph"
      ],
      "externalLinks": []
    },
    {
      "id": "licensing",
      "title": "Открытость и лицензии",
      "path": "wiki/engine/licensing.md",
      "coordinates": [
        4.0,
        3.0,
        6.0,
        2.0,
        3.0,
        5.0
      ],
      "body": "# Открытость и лицензии\n\nДвижок и эталонный индексатор открыты по GNU AGPL. Документация и статьи\nраспространяются по CC BY-SA. Спецификация индекса доступна по CC0, чтобы любой\nмог независимо реализовать совместимый индексатор или внешний коннектор.\n\nРаботающая публичная копия должна заметно ссылаться на свой публичный Git-\nрепозиторий, репозиторий-родитель при его наличии и первоисточник проекта.\n\nЗакрытые знания и персональные данные не становятся открытыми только потому,\nчто их отображает открытый движок. Независимая программа может подготовить\nсовместимый индекс из PostgreSQL или другого источника, не включая закрытые\nданные в этот репозиторий.\n\nЮридически значимые полные тексты находятся в корневых файлах репозитория, а\nэта статья служит навигационным объяснением.\n",
      "home": false,
      "map": false,
      "incomingCount": 1,
      "outgoingIds": [],
      "linkedIds": [
        "engine-about"
      ],
      "externalLinks": []
    },
    {
      "id": "number",
      "title": "Число",
      "path": "wiki/mathematics/number.md",
      "coordinates": [
        5.0,
        2.0,
        4.0,
        4.0,
        3.0,
        6.0
      ],
      "body": "# Число\n\nЧисло выражает количество, порядок или отношение. Шесть исходных компонентов\nHexrelatum являются положительными числами не меньше единицы.\n\nПри отображении противоположная пара чисел превращается в относительное\nположение на одной видимой оси. См. [Шесть координат](../engine/coordinates.md).\n",
      "home": false,
      "map": false,
      "incomingCount": 0,
      "outgoingIds": [
        "six-coordinates"
      ],
      "linkedIds": [
        "six-coordinates"
      ],
      "externalLinks": []
    },
    {
      "id": "six-coordinates",
      "title": "Шесть координат",
      "path": "wiki/engine/coordinates.md",
      "coordinates": [
        6.0,
        6.0,
        2.0,
        5.0,
        4.0,
        7.0
      ],
      "body": "# Шесть координат\n\nИсточник положения статьи — шесть положительных компонентов, объединённых в\nтри противоположные пары. Трёхмерная точка является только относительной\nпроекцией этих данных.\n\nРавные компоненты одной пары уравновешивают друг друга. Например, `6` и `6`\nнормализуются как `0.5` и `0.5`, поэтому видимая координата этой оси равна нулю.\n\nТочки `(1, 1, 1, 1, 1, 1)` и `(2, 2, 2, 2, 2, 2)` обе оказываются в центре\nсобственной глобальной проекции, но исходные шестикомпонентные значения не\nтеряются. Цветовая формула и семантика полюсов пока не закреплены.\n\nПодробнее о связях между точками рассказывает статья [Граф](../mathematics/graph.md).\n",
      "home": false,
      "map": false,
      "incomingCount": 1,
      "outgoingIds": [
        "graph"
      ],
      "linkedIds": [
        "graph",
        "number"
      ],
      "externalLinks": []
    }
  ]
}
